[
  {
    "version": "0.0.2",
    "versionCode": 2,
    "publishedAt": "2026-07-22T04:18:36Z",
    "downloadUrl": "https://github.com/dahsameer/litter/releases/download/v0.0.2/litter_0.0.2.apk",
    "releaseNotes": "fixed app\r\nfixed updater",
    "apkSize": 2550928,
    "prerelease": false,
    "draft": false,
    "sha256": "b2c4ec7e4e01f5ab09e3ebd7e6e6da8615dad5529fcffd56a1de264d5ff5b340"
  }
]
